{
  "schema_version": "1.0.0",
  "scanner": {
    "name": "stacksentry",
    "version": "0.1.0"
  },
  "scan": {
    "type": "compose",
    "started_at": "2026-10-01T12:00:00Z",
    "finished_at": "2026-10-01T12:00:00Z",
    "rules_total": 27,
    "rules_evaluated": 27,
    "options": {
      "min_severity": "info",
      "fail_on": null,
      "only": [],
      "exclude": []
    }
  },
  "target": {
    "type": "compose",
    "name": "examples/insecure-compose.yaml",
    "compose": {
      "files": [
        "examples/insecure-compose.yaml"
      ],
      "project_name": "insecure-demo",
      "service_count": 3,
      "services": [
        "db",
        "manager",
        "metrics"
      ]
    }
  },
  "summary": {
    "total": 35,
    "by_severity": {
      "critical": 2,
      "high": 5,
      "medium": 13,
      "low": 13,
      "info": 2
    },
    "displayed": 35,
    "hidden_below_min_severity": 0,
    "suppressed": 0,
    "fail_on": null,
    "at_or_above_fail_on": 0,
    "result": "no_threshold"
  },
  "findings": [
    {
      "id": "8a4326b7c0c9c4a8",
      "rule_id": "SST-SEC-001",
      "rule_version": "1.0",
      "title": "Docker socket mount detected",
      "category": "security",
      "severity": "critical",
      "confidence": "high",
      "target_type": "service",
      "target_name": "manager",
      "location": {
        "file": "examples/insecure-compose.yaml",
        "line": 7
      },
      "description": "The Docker daemon socket is mounted into the container.",
      "evidence": [
        "/var/run/docker.sock:/var/run/docker.sock"
      ],
      "why_it_matters": "Access to the Docker socket can effectively grant host-level control: anyone who can talk to it can start privileged containers and mount the host filesystem. Mounting it read-only (:ro) does not restrict API calls.",
      "remediation": "Remove the mount unless this service explicitly requires Docker daemon access. If it does (for example a reverse proxy reading container labels), put a filtering socket proxy in front of the socket that only allows the required read-only API endpoints.",
      "documentation": "https://github.com/6-SlX-6/stacksentry/blob/main/docs/rules.md#sst-sec-001",
      "references": [
        "https://docs.docker.com/engine/security/#docker-daemon-attack-surface",
        "https://cheatsheetseries.owasp.org/cheatsheets/Docker_Security_Cheat_Sheet.html"
      ],
      "timestamp": "2026-10-01T12:00:00Z",
      "scanner_version": "0.1.0"
    },
    {
      "id": "11e6439a2ce73bf0",
      "rule_id": "SST-SEC-002",
      "rule_version": "1.0",
      "title": "Privileged container detected",
      "category": "security",
      "severity": "critical",
      "confidence": "high",
      "target_type": "service",
      "target_name": "manager",
      "location": {
        "file": "examples/insecure-compose.yaml",
        "line": 7
      },
      "description": "The service runs in privileged mode.",
      "evidence": [
        "privileged: true"
      ],
      "why_it_matters": "privileged: true grants all Linux capabilities and access to all host devices and disables most isolation (seccomp, AppArmor/SELinux confinement). A compromise of the process is close to a compromise of the host.",
      "remediation": "Remove privileged: true. Grant only the specific capabilities (cap_add) or devices (devices) the workload needs, and document why they are required.",
      "documentation": "https://github.com/6-SlX-6/stacksentry/blob/main/docs/rules.md#sst-sec-002",
      "references": [
        "https://docs.docker.com/reference/compose-file/services/#privileged",
        "https://cheatsheetseries.owasp.org/cheatsheets/Docker_Security_Cheat_Sheet.html"
      ],
      "timestamp": "2026-10-01T12:00:00Z",
      "scanner_version": "0.1.0"
    },
    {
      "id": "e46a3ed4760a2598",
      "rule_id": "SST-NET-001",
      "rule_version": "1.0",
      "title": "Publicly published database port",
      "category": "networking",
      "severity": "high",
      "confidence": "high",
      "target_type": "service",
      "target_name": "db",
      "location": {
        "file": "examples/insecure-compose.yaml",
        "line": 23
      },
      "description": "A database port is published on all host interfaces.",
      "evidence": [
        "5432:5432/tcp (PostgreSQL port published on all host interfaces)"
      ],
      "why_it_matters": "Published database ports are reachable from other machines and, on many Linux hosts, bypass host firewalls such as UFW or firewalld because Docker manages its own iptables rules. Databases reachable from the network are frequent targets of credential brute-forcing and ransom attacks.",
      "remediation": "Remove the ports entry if only other containers need the database; they can reach it over the Compose network by service name. If host access is required, bind to localhost, e.g. \"127.0.0.1:5432:5432\". Exposure may be intentional, but it should be reviewed.",
      "documentation": "https://github.com/6-SlX-6/stacksentry/blob/main/docs/rules.md#sst-net-001",
      "references": [
        "https://docs.docker.com/reference/compose-file/services/#ports",
        "https://docs.docker.com/engine/network/packet-filtering-firewalls/"
      ],
      "timestamp": "2026-10-01T12:00:00Z",
      "scanner_version": "0.1.0"
    },
    {
      "id": "e0abd0ee9485f606",
      "rule_id": "SST-OPS-003",
      "rule_version": "1.0",
      "title": "No restart policy configured",
      "category": "reliability",
      "severity": "high",
      "confidence": "high",
      "target_type": "service",
      "target_name": "db",
      "location": {
        "file": "examples/insecure-compose.yaml",
        "line": 23
      },
      "description": "No restart policy is configured, so the container stays down after a crash or host reboot.",
      "evidence": [
        "restart is missing"
      ],
      "why_it_matters": "Docker's default restart policy is \"no\". A long-running service that crashes, or whose host reboots, stays down until someone intervenes.",
      "remediation": "Add: restart: unless-stopped (or always / on-failure, depending on the desired behavior).",
      "documentation": "https://github.com/6-SlX-6/stacksentry/blob/main/docs/rules.md#sst-ops-003",
      "references": [
        "https://docs.docker.com/reference/compose-file/services/#restart"
      ],
      "timestamp": "2026-10-01T12:00:00Z",
      "scanner_version": "0.1.0"
    },
    {
      "id": "04178f8fc64041ab",
      "rule_id": "SST-OPS-003",
      "rule_version": "1.0",
      "title": "No restart policy configured",
      "category": "reliability",
      "severity": "high",
      "confidence": "high",
      "target_type": "service",
      "target_name": "manager",
      "location": {
        "file": "examples/insecure-compose.yaml",
        "line": 7
      },
      "description": "No restart policy is configured, so the container stays down after a crash or host reboot.",
      "evidence": [
        "restart is missing"
      ],
      "why_it_matters": "Docker's default restart policy is \"no\". A long-running service that crashes, or whose host reboots, stays down until someone intervenes.",
      "remediation": "Add: restart: unless-stopped (or always / on-failure, depending on the desired behavior).",
      "documentation": "https://github.com/6-SlX-6/stacksentry/blob/main/docs/rules.md#sst-ops-003",
      "references": [
        "https://docs.docker.com/reference/compose-file/services/#restart"
      ],
      "timestamp": "2026-10-01T12:00:00Z",
      "scanner_version": "0.1.0"
    },
    {
      "id": "bde3b223ac5fff85",
      "rule_id": "SST-SEC-003",
      "rule_version": "1.0",
      "title": "Host network mode detected",
      "category": "security",
      "severity": "high",
      "confidence": "high",
      "target_type": "service",
      "target_name": "metrics",
      "location": {
        "file": "examples/insecure-compose.yaml",
        "line": 18
      },
      "description": "The service shares the host's network stack (network_mode: host).",
      "evidence": [
        "network_mode: host"
      ],
      "why_it_matters": "Host networking removes normal Docker network isolation: every port the process opens is reachable on all host interfaces, port publishing rules no longer apply, and the container can reach services bound to the host's localhost.",
      "remediation": "Use a bridge network and publish only the required ports, preferably bound to 127.0.0.1 or a specific interface. Keep host networking only for workloads that need it (for example some discovery or VPN tools) and document the exception.",
      "documentation": "https://github.com/6-SlX-6/stacksentry/blob/main/docs/rules.md#sst-sec-003",
      "references": [
        "https://docs.docker.com/reference/compose-file/services/#network_mode"
      ],
      "timestamp": "2026-10-01T12:00:00Z",
      "scanner_version": "0.1.0"
    },
    {
      "id": "b2fd1ad5fc2cc772",
      "rule_id": "SST-SEC-011",
      "rule_version": "1.0",
      "title": "Likely secret in environment variable",
      "category": "secrets",
      "severity": "high",
      "confidence": "high",
      "target_type": "service",
      "target_name": "db",
      "location": {
        "file": "examples/insecure-compose.yaml",
        "line": 23
      },
      "description": "An environment variable that looks like a credential has an inline value in the Compose file.",
      "evidence": [
        "POSTGRES_PASSWORD=********"
      ],
      "why_it_matters": "Inline secrets end up in version control, backups, CI logs and docker inspect output, and are visible to everyone who can read the Compose file.",